<TcMenuPlugin name="Embedded OpenJDK / JavaFX renderer" id="59f05a22-8873-4bfe-86d4-73ef874a0283" subsystem="DISPLAY" needsTheme="false"
              xmlns="https://www.thecoderscorner.com/libraries/tcmenuPluginItem" xmlns:xsi="http://www.w3.org/2001/XMLSchema-instance"
              xsi:schemaLocation="https://www.thecoderscorner.com/libraries/tcmenuPluginItem https://tcmenu.github.io/documentation/arduino-libraries/libraries/tcmenu-plugin-item.xsd">
    <SupportedPlatforms>
        <Platform>RASPBERRY_PIJ</Platform>
    </SupportedPlatforms>
    <Description>JavaFX application and framework that can be used to render the menu onto an embedded Linux device such as a Raspberry PI.</Description>
    <Documentation link="https://tcmenu.github.io/documentation/arduino-libraries/tc-menu/tcmenu-plugins/tcmenu-openjfx-raspberrypi-plugin/"/>
    <RequiredLibraries/>
    <ImageFile>embedded-java.png</ImageFile>

    <Properties>
        <Property id="JDK_INCLUDES_JAVAFX" name="%java.includes.openjfx" initial="false"  type="boolean"
                  desc="%java.includes.openjfx.desc"/>
    </Properties>

    <ApplicabilityDefs/>

    <SourceFiles>
        <Replacement find="PACKAGE_NAME_REPLACEMENT" replace="${NAMESPACE}"/>
        <SourceFile name="emb_jfx/JfxLocalAutoUI.java" />
        <SourceFile name="emb_jfx/LocalTreeComponentManager.java" />
    </SourceFiles>

    <IncludeFiles>
        <!-- dependencies needed for just in time UI -->
        <Header name="${NAMESPACE}.tcmenu.plugins.*" inSource="true"/>
        <Header name="javafx.application.Application" inSource="true"/>
        <Header name="mvn:com.thecoderscorner.tcmenu/embedCONTROLCore@${tcmenu.api.version}" inSource="false"/>
        <Header name="mvn:org.openjfx/javafx-controls@${jfx.version}" inSource="false" whenProperty="JDK_INCLUDES_JAVAFX" isValue="false" />
        <Header name="mvn:org.openjfx/javafx-fxml@${jfx.version}" inSource="false" whenProperty="JDK_INCLUDES_JAVAFX" isValue="false"/>
        <Header name="mod:requires:javafx.graphics" inSource="false"/>
        <Header name="mod:requires:javafx.base" inSource="false"/>
        <Header name="mod:requires:javafx.controls" inSource="false"/>
        <Header name="mod:requires:javafx.fxml" inSource="false"/>
    </IncludeFiles>

    <GlobalVariables>
    </GlobalVariables>

    <SetupFunctions>
        <Function object="JfxLocalAutoUI" name="setAppContext" >
            <Param value="context"/>
        </Function>

        <Function object="Application" name="launch" neverReturns="true">
            <Param value="JfxLocalAutoUI.class"/>
        </Function>
    </SetupFunctions>
</TcMenuPlugin>