<TcMenuPlugin name="Completely custom rendering starting from scratch"
              id="8f4821df-c98e-4761-b824-898482df33a5" subsystem="DISPLAY"
              xmlns="https://www.thecoderscorner.com/libraries/tcmenuPluginItem" xmlns:xsi="http://www.w3.org/2001/XMLSchema-instance"
              xsi:schemaLocation="https://www.thecoderscorner.com/libraries/tcmenuPluginItem https://www.thecoderscorner.com/libraries/tcmenu-plugin-item.xsd">
    <SupportedPlatforms>
       <Platform>ARDUINO_UNO</Platform>
       <Platform>ARDUINO_AVR</Platform>
       <Platform>ARDUINO_32</Platform>
       <Platform>ARDUINO_ESP8266</Platform>
       <Platform>ARDUINO_ESP32</Platform>
       <Platform>MBED_RTOS</Platform>
    </SupportedPlatforms>
    <Description>Advanced library usage (prefer customDrawable for most graphical drivers). This allows you to write a custom renderer from scratch, see the documentation link.</Description>
    <Documentation link="https://www.thecoderscorner.com/products/arduino-libraries/tc-menu/customise-menu-input-display-plugin/"/>
    <RequiredLibraries/>
    <ImageFile>custom-display.jpg</ImageFile>

    <Properties>
        <Property id="HEADER_FILE" name="Renderer Header File" initial="" desc="Header file needed for compilation" type="header"/>
        <Property id="CLASS_NAME" name="Renderer Class Type" initial="" desc="The class type for your renderer" type="variable"/>
    </Properties>

    <ApplicabilityDefs/>

    <SourceFiles/>

    <IncludeFiles>
        <Header name="BaseRenderer.h" inSource="false"/>
        <Header name="${HEADER_FILE}.h" inSource="true"/>
    </IncludeFiles>

    <GlobalVariables>
        <Variable name="renderer" type="${CLASS_NAME}" export="only" progmem="false"/>
    </GlobalVariables>

    <SetupFunctions/>
</TcMenuPlugin>