<TcMenuPlugin name="%one.button.name"
              id="4F92CBC0-D13A-4090-9B86-C1952FE42D9B" subsystem="INPUT"
              requiresDesigner="2.2"
              xmlns="https://www.thecoderscorner.com/libraries/tcmenuPluginItem" xmlns:xsi="http://www.w3.org/2001/XMLSchema-instance"
              xsi:schemaLocation="https://www.thecoderscorner.com/libraries/tcmenuPluginItem https://tcmenu.github.io/documentation/arduino-libraries/libraries/tcmenu-plugin-item.xsd">
    <SupportedPlatforms>
        <PlatformGroup>Arduino</PlatformGroup>
        <PlatformGroup>TrueCpp</PlatformGroup>
    </SupportedPlatforms>
    <Description>%one.button.desc</Description>
    <Documentation link="https://tcmenu.github.io/documentation/arduino-libraries/tc-menu/tcmenu-plugins/encoder-switches-input-plugin/"/>
    <RequiredLibraries/>
    <ImageFile>user-button.jpg</ImageFile>

    <Properties>
        <Property id="SW_POLLING_MODE" name="%core.input.polling" initial="SWITCHES_POLL_EVERYTHING" desc="%core.input.polling.desc" type="choice">
            <Choices>
                <Choice desc="%core.input.polling.none">SWITCHES_NO_POLLING</Choice>
                <Choice desc="%core.input.polling.all">SWITCHES_POLL_EVERYTHING</Choice>
                <Choice desc="%core.input.polling.keys">SWITCHES_POLL_KEYS_ONLY</Choice>
            </Choices>
        </Property>
        <Property id="SWITCH_IODEVICE" name="%core.switch.io.device" initial="devicePins" desc="%core.switch.io.device.desc" type="io-device"/>
        <Property id="BUTTON_PIN" name="%one.button.pin" initial="2" desc="%one.button.pin" type="pin"/>
        <Property id="PULLUP_LOGIC" name="%core.pullup.logic" initial="true" desc="%core.pullup.logic.desc" type="boolean"/>
        <Property id="DOUBLE_CLICK_THRESHOLD" name="%double.click.threshold" initial="true" desc="%double.click.threshold" type="int" min="100" max="1000"/>
    </Properties>

    <ApplicabilityDefs/>

    <SourceFiles/>

    <IncludeFiles>
        <Header name="extras/TcOneButtonHandler.h" inSource="false" />
    </IncludeFiles>

    <GlobalVariables>
        <Variable name="oneButtonHandler" export="true" type="TcOneButtonHandler">
            <Param value="${BUTTON_PIN}"/>
            <Param value="${DOUBLE_CLICK_THRESHOLD}"/>
        </Variable>
    </GlobalVariables>

    <SetupFunctions>
        <Function name="init" object="switches">
            <Param ioDevice="${SWITCH_IODEVICE}" />
            <Param value="${SW_POLLING_MODE}" />
            <Param value="${PULLUP_LOGIC}"/>
        </Function>

        <Function name="initWithoutInput" object="menuMgr" >
            <Param ref="renderer"/>
            <Param ref="${ROOT}"/>
        </Function>

        <Function name="start" object="oneButtonHandler"/>
    </SetupFunctions>
</TcMenuPlugin>
