<TcMenuPlugin name="%theme.manual" id="b186c809-d9ef-4ca8-9d4b-e4780a041ccc"
              subsystem="THEME" requiresDesigner="2.0"
              xmlns="https://www.thecoderscorner.com/libraries/tcmenuPluginItem" xmlns:xsi="http://www.w3.org/2001/XMLSchema-instance"
              xsi:schemaLocation="https://www.thecoderscorner.com/libraries/tcmenuPluginItem https://tcmenu.github.io/documentation/arduino-libraries/libraries/tcmenu-plugin-item.xsd">
    <SupportedPlatforms>
       <All/>
    </SupportedPlatforms>
    <Description>%theme.manual.desc</Description>
    <Documentation link="https://tcmenu.github.io/documentation/arduino-libraries/tc-menu/rendering-with-tcmenu-lcd-tft-oled/"/>
    <RequiredLibraries/>
    <ImageFile>no-theme.png</ImageFile>

    <Properties/>

    <ApplicabilityDefs/>

    <SourceFiles/>

    <IncludeFiles/>

    <GlobalVariables/>

    <SetupFunctions/>

</TcMenuPlugin>