<TcMenuPlugin name="Serve up embedCONTROL JS from webserver" id="36f98a10-7ffc-468c-8b6b-3961b5c87cbe" subsystem="REMOTE"
              xmlns="https://www.thecoderscorner.com/libraries/tcmenuPluginItem" xmlns:xsi="http://www.w3.org/2001/XMLSchema-instance"
              xsi:schemaLocation="https://www.thecoderscorner.com/libraries/tcmenuPluginItem https://www.thecoderscorner.com/libraries/tcmenu-plugin-item.xsd">
    <SupportedPlatforms>
        <Platform>RASPBERRY_PIJ</Platform>
    </SupportedPlatforms>
    <Description>Control your embedded device remotely using embedCONTROL JS served up using a Jetty webserver. A lightweight React.JS app is served that needs no installation.</Description>
    <Documentation link="https://www.thecoderscorner.com/products/arduino-libraries/tc-menu/tcmenu-iot/embedcontroljs-webserver-plugin/"/>
    <RequiredLibraries/>
    <ImageFile>embedCONTROLJS.png</ImageFile>

    <Properties>
        <Property id="EJ_WWW_STATIC_DIR" name="Webserver static files directory" initial="./data/www" type="text"
                  desc="The filesystem location of the static files, usually relative to the app start directory"/>
        <Property id="EJ_WEB_SERVER_PORT" name="HTTP port to listen on" initial="8080" type="int"
                  desc="Port on which to listen for HTTP requests, to listen on port 80 we recommend a proxy"/>
        <Property id="EJ_DIRECTORY_LISTING" name="List directories in webserver" initial="false" type="boolean"
                  desc="Turn on or off directory listing when no index file exists"/>
    </Properties>

    <ApplicabilityDefs/>

    <SourceFiles>
        <ZipDataFile name="embedCONTROL.zip" dest="${EJ_WWW_STATIC_DIR}"/>
    </SourceFiles>

    <IncludeFiles>
        <Header name="mvn:org.eclipse.jetty/jetty-server@10.0.9" inSource="false"/>
        <Header name="mvn:org.eclipse.jetty.websocket/websocket-javax-server@10.0.9" inSource="false"/>
        <Header name="mvn:org.slf4j/slf4j-jdk14@1.7.36" inSource="false"/>

        <Header name="mod:requires:org.eclipse.jetty.server" inSource="false"/>
        <Header name="mod:requires:org.eclipse.jetty.servlet" inSource="false"/>
        <Header name="mod:requires:jetty.websocket.api" inSource="false"/>
        <Header name="mod:requires:org.eclipse.jetty.websocket.javax.server" inSource="false"/>
    </IncludeFiles>

    <GlobalVariables>
        <Variable name="tagVal" type="ConfigurableProtocolConverter" inContext="true" export="false"/>

        <Variable name="webServer" type="TcJettyWebServer" export="true" inContext="true" >
            <Param ref="ConfigurableProtocolConverter.class" name="protocol" type="ConfigurableProtocolConverter"/>
            <Param ref="Clock.class" name="clock" type="Clock"/>
            <Param value="${EJ_WWW_STATIC_DIRECTORY}" name="dataDir"/>
            <Param value="${EJ_WEB_SOCKET_PORT}" name="wsPort"/>
        </Variable>
    </GlobalVariables>

    <SetupFunctions>
        <Function name="addConnectionManager" object="manager">
            <Param value="webServer"/>
        </Function>
    </SetupFunctions>
</TcMenuPlugin>