<TcMenuPlugin name="%custom.drawable.name"
              id="2202fd9e-3a92-48eb-a70a-8d331793e0b4"
              subsystem="DISPLAY" needsTheme="true"
              xmlns="https://www.thecoderscorner.com/libraries/tcmenuPluginItem" xmlns:xsi="http://www.w3.org/2001/XMLSchema-instance"
              xsi:schemaLocation="https://www.thecoderscorner.com/libraries/tcmenuPluginItem https://www.thecoderscorner.com/products/arduino-libraries/libraries/tcmenu-plugin-item.xsd">
    <SupportedPlatforms>
        <PlatformGroup>Arduino</PlatformGroup>
        <PlatformGroup>TrueCpp</PlatformGroup>
    </SupportedPlatforms>
    <Description>%custom.drawable.desc</Description>
    <Documentation link="https://www.thecoderscorner.com/products/arduino-libraries/tc-menu/customise-menu-input-display-plugin/"/>
    <RequiredLibraries/>
    <ImageFile>custom-display.jpg</ImageFile>

    <Properties>
        <Property id="UPDATES_PER_SEC" name="%core.screen.updates.sec" initial="5" desc="%core.screen.updates.sec.desc" type="int" min="1" max="30"/>
        <Property id="CLASS_NAME" name="%complete.custom.class.name" initial="MyCustomDrawing" desc="%complete.custom.class.name.desc" type="variable"/>
    </Properties>

    <ApplicabilityDefs/>

    <SourceFiles>
        <Replacement find="CustomScreenDrawable" replace="${CLASS_NAME}Drawable" />
        <SourceFile name="emptyDrawable/CustomDisplayDrawable.h" overwrite="false" />
    </SourceFiles>

    <IncludeFiles>
        <Header name="graphics/GraphicsDeviceRenderer.h" inSource="false"/>
        <Header name="${SRC_DIR_OFFSET}CustomDisplayDrawable.h" inSource="cppSrc"/>
    </IncludeFiles>

    <GlobalVariables>
        <Variable name="renderer" type="GraphicsDeviceRenderer" export="true">
            <Param value="30"/>
            <Param value="applicationInfo.name"/>
            <Param value="new ${CLASS_NAME}Drawable()"/>
        </Variable>
    </GlobalVariables>

    <SetupFunctions>
        <Function object="renderer" name="setUpdatesPerSecond">
            <Param value="${UPDATES_PER_SEC}"/>
        </Function>
    </SetupFunctions>
</TcMenuPlugin>