<TcMenuPlugin name="%core.no.display" id="cdd0be35-f6ff-40ae-86fc-f9d04a6e8679" subsystem="DISPLAY"
              xmlns="https://www.thecoderscorner.com/libraries/tcmenuPluginItem" xmlns:xsi="http://www.w3.org/2001/XMLSchema-instance"
              xsi:schemaLocation="https://www.thecoderscorner.com/libraries/tcmenuPluginItem https://tcmenu.github.io/documentation/arduino-libraries/libraries/tcmenu-plugin-item.xsd">
    <SupportedPlatforms>
       <All/>
    </SupportedPlatforms>
    <Description>%core.no.display.desc</Description>
    <Documentation link="https://tcmenu.github.io/documentation/arduino-libraries/tc-menu/tcmenu-plugins/customise-menu-input-display-plugin/"/>
    <RequiredLibraries/>
    <ImageFile>no-display.png</ImageFile>

    <Properties/>

    <ApplicabilityDefs/>

    <SourceFiles/>

    <IncludeFiles>
        <Header name="BaseRenderers.h" inSource="false" whenProperty="TARGET" isNotValue="RASPBERRY_PIJ"/>
    </IncludeFiles>

    <GlobalVariables>

        <Variable name="renderer" type="NoRenderer" export="true" progmem="false" whenProperty="TARGET" isNotValue="RASPBERRY_PIJ"/>
    </GlobalVariables>

    <SetupFunctions>
        <!-- For Embedded Java normally the display starts the menu, to keep the ordering intact, for no-display we must do it -->
        <Function object="MenuManager.class" name="start" whenProperty="TARGET" isValue="RASPBERRY_PIJ"/>
    </SetupFunctions>
</TcMenuPlugin>