<TcMenuPlugin name="Device client connection to remote server using popular libraries" id="B93C6ACA-F1A3-4FF3-87F1-07E4F2F1ED5A" subsystem="REMOTE"
              requiresDesigner="2.2.0" xmlns="https://www.thecoderscorner.com/libraries/tcmenuPluginItem" xmlns:xsi="http://www.w3.org/2001/XMLSchema-instance"
              xsi:schemaLocation="https://www.thecoderscorner.com/libraries/tcmenuPluginItem https://www.thecoderscorner.com/products/arduino-libraries/libraries/tcmenu-plugin-item.xsd">
    <SupportedPlatforms>
        <Platform>ARDUINO_UNO</Platform>
        <Platform>ARDUINO_AVR</Platform>
        <Platform>ARDUINO_32</Platform>
        <Platform>ARDUINO_ESP8266</Platform>
        <Platform>ARDUINO_ESP32</Platform>
        <Platform>STM32DUINO</Platform>
    </SupportedPlatforms>
    <Description>Control menu remotely where the device acts as a client. The device will attempt to connect to a server at a provided IP address.</Description>
    <Documentation link="https://www.thecoderscorner.com/products/arduino-libraries/tc-menu/tcmenu-iot/ethernet-remote-plugin/"/>
    <RequiredLibraries/>
    <ImageFile>ethernet-shield.jpg</ImageFile>

    <Properties>
        <Property id="ETH_LIBRARY_TYPE" name="Ethernet library type" desc="Choose the library that supports your hardware" initial="ETHERNET_2" type="choice">
            <Choices>
                <Choice desc="Ethernet 2">ETHERNET_2</Choice>
                <Choice desc="UIP Ethernet">UIP_ENC28J60</Choice>
                <Choice desc="STM32Ethernet">STM32ETHERNET</Choice>
                <Choice desc="ESP32 Arduino">ESP32_WIFI</Choice>
                <Choice desc="ESP8266 Arduino">ESP8266_WIFI</Choice>
            </Choices>
        </Property>
        <Property id="REMOTE_IP_ADDRESS" name="IP Address of the server" initial="127.0.0.1" type="text"
                  desc="The IP address of the server to connect to."/>
        <Property id="REMOTE_PORT" name="Remote Port" initial="3333" desc="The port on which the server is listening"
                  type="int" min="0" max="65355"/>
    </Properties>

    <ApplicabilityDefs>
    </ApplicabilityDefs>

    <SourceFiles>
        <Replacement find="Ethernet.h" replace="STM32Ethernet.h" whenProperty="ETH_LIBRARY_TYPE" isValue="STM32ETHERNET"/>
        <Replacement find="Ethernet.h" replace="UIPEthernet.h" whenProperty="ETH_LIBRARY_TYPE" isValue="UIP_ENC28J60"/>
        <Replacement find="Ethernet.h" replace="WiFi.h" whenProperty="ETH_LIBRARY_TYPE" isValue="ESP32_WIFI"/>
        <Replacement find="Ethernet.h" replace="ESP8266WiFi.h" whenProperty="ETH_LIBRARY_TYPE" isValue="ESP8266_WIFI"/>

        <Replacement find="EthernetClient" replace="UIPClient" whenProperty="ETH_LIBRARY_TYPE" isValue="UIP_ENC28J60"/>
        <Replacement find="EthernetServer" replace="UIPServer" whenProperty="ETH_LIBRARY_TYPE" isValue="UIP_ENC28J60"/>

        <Replacement find="EthernetClient" replace="WiFiClient" whenProperty="ETH_LIBRARY_TYPE" matches="ESP.*"/>
        <Replacement find="EthernetServer" replace="WiFiServer" whenProperty="ETH_LIBRARY_TYPE" matches="ESP.*"/>

        <SourceFile name="ethernetSrc/ClientEthernetTransport.cpp"/>
        <SourceFile name="ethernetSrc/ClientEthernetTransport.h"/>
    </SourceFiles>

    <IncludeFiles>
        <Header name="ClientEthernetTransport.h" inSource="true"/>
        <Header name="RemoteConnector.h" inSource="false"/>
    </IncludeFiles>

    <GlobalVariables>
        <Variable name="clientEthInit" type="ClientEthernetInitialisation" export="true">
            <Param value='"${REMOTE_IP_ADDRESS}"' />
            <Param value="${REMOTE_PORT}" />
        </Variable>
        <Variable name="clientEthTransport" type="ClientEthernetTagValTransport" export="true"/>
        <Variable name="clientConnection" type="TagValueRemoteServerConnection" export="false">
            <Param value="clientEthTransport"/>
            <Param value="clientEthInit"/>
        </Variable>

    </GlobalVariables>

    <SetupFunctions>
        <Function name="addConnection" object="remoteServer">
            <Param ref="clientConnection"/>
        </Function>

    </SetupFunctions>
</TcMenuPlugin>