<TcMenuPlugin name="No remote capabilities" id="2c101fec-1f7d-4ff3-8d2b-992ad41e7fcb" subsystem="REMOTE"
              xmlns="https://www.thecoderscorner.com/libraries/tcmenuPluginItem" xmlns:xsi="http://www.w3.org/2001/XMLSchema-instance"
              xsi:schemaLocation="https://www.thecoderscorner.com/libraries/tcmenuPluginItem https://www.thecoderscorner.com/libraries/tcmenu-plugin-item.xsd">
    <SupportedPlatforms>
        <Platform>ARDUINO_UNO</Platform>
        <Platform>ARDUINO_AVR</Platform>
        <Platform>ARDUINO_32</Platform>
        <Platform>ARDUINO_ESP8266</Platform>
        <Platform>ARDUINO_ESP32</Platform>
        <Platform>STM32DUINO</Platform>
        <Platform>RASPBERRY_PIJ</Platform>
        <Platform>MBED_RTOS</Platform>
    </SupportedPlatforms>
    <Description>Select this option when you don't need any remote control functionality.</Description>
    <Documentation link="https://www.thecoderscorner.com/products/arduino-libraries/tc-menu/menu-library-remote-connectivity/"/>
    <RequiredLibraries/>
    <ImageFile>no-display.png</ImageFile>

    <Properties/>

    <ApplicabilityDefs/>

    <SourceFiles/>

    <IncludeFiles/>

    <GlobalVariables/>

    <SetupFunctions/>
</TcMenuPlugin>