<TcMenuPlugin name="Control menu with analog joystick"
              id="20409bb8-b8a1-4d1d-b632-2cf9b57353e3" subsystem="INPUT"
              requiresDesigner="2.2"
              xmlns="https://www.thecoderscorner.com/libraries/tcmenuPluginItem" xmlns:xsi="http://www.w3.org/2001/XMLSchema-instance"
              xsi:schemaLocation="https://www.thecoderscorner.com/libraries/tcmenuPluginItem https://www.thecoderscorner.com/libraries/tcmenu-plugin-item.xsd">
<SupportedPlatforms>
       <Platform>ARDUINO_UNO</Platform>
       <Platform>ARDUINO_AVR</Platform>
       <Platform>ARDUINO_32</Platform>
       <Platform>STM32DUINO</Platform>
       <Platform>ARDUINO_ESP8266</Platform>
       <Platform>ARDUINO_ESP32</Platform>
       <Platform>MBED_RTOS</Platform>
</SupportedPlatforms>
    <Description>Use an analog joystick connected to one of the Arduino inbuilt analog pins along with a switch also connected to an Arduino pin.</Description>
    <Documentation link="https://www.thecoderscorner.com/products/arduino-libraries/tc-menu/tcmenu-plugins/encoder-switches-input-plugin/"/>
    <RequiredLibraries/>
    <ImageFile>joystick.jpg</ImageFile>

    <Properties>
        <Property id="SW_POLLING_MODE" name="Polling / Interrupt mode" initial="SWITCHES_POLL_EVERYTHING" desc="Choose how switches should poll / use interrupts" type="choice">
            <Choices>
                <Choice desc="Polling for keys and encoders">SWITCHES_POLL_EVERYTHING</Choice>
                <Choice desc="Everything interrupt driven">SWITCHES_NO_POLLING</Choice>
                <Choice desc="Keys polling, encoder A pin interrupt">SWITCHES_POLL_KEYS_ONLY</Choice>
            </Choices>
        </Property>
        <Property id="SWITCH_IODEVICE" name="IoAbstractionRef for Switches" initial="devicePins" desc="Advanced: IoAbstractionRef (default is Arduino pins)" type="io-device"/>
        <Property id="JOYSTICK_PIN" name="Analog Pin" initial="A0" desc="The analog pin the joystick is connected" type="pin"/>
        <Property id="BUTTON_PIN" name="Button Pin" initial="3" desc="The pin on which the button is connected" type="pin"/>
        <Property id="PULLUP_LOGIC" name="PullUp Logic" initial="true" desc="Enable this to use pull up logic, otherwise pull down" type="boolean"/>
    </Properties>

    <ApplicabilityDefs/>

    <SourceFiles/>

    <IncludeFiles>
        <Header name="JoystickSwitchInput.h" inSource="false"/>
    </IncludeFiles>

    <GlobalVariables>
        <Variable name="analogDevice" type="ArduinoAnalogDevice" export="true" whenProperty="TARGET" isNotValue="MBED_RTOS"/>
        <Variable name="analogDevice" type="MBedAnalogDevice" export="true" whenProperty="TARGET" isValue="MBED_RTOS"/>
    </GlobalVariables>

    <SetupFunctions>
        <Function name="init" object="switches">
            <Param ioDevice="${SWITCH_IODEVICE}" />
            <Param value="${SW_POLLING_MODE}" />
            <Param value="${PULLUP_LOGIC}"/>
        </Function>

        <Lambda name="onReleaseFn">
            <Param type="pinid_t" name="/*key*/"/>
            <Param type="bool" name="held"/>
            <Function name="onMenuSelect" object="menuMgr">
                <Param value="held"/>
            </Function>
        </Lambda>
        <Function name="addSwitch" object="switches">
            <Param value="${BUTTON_PIN}"/>
            <Param ref="NULL"/>
        </Function>
        <Function name="onRelease" object="switches">
            <Param value="${BUTTON_PIN}"/>
            <Param lambda="onReleaseFn"/>
        </Function>

        <Lambda name="analogReadFn">
            <Param type="int" name="val"/>
            <Function name="valueChanged" object="menuMgr">
                <Param value="val"/>
            </Function>
        </Lambda>
        <Function name="setupAnalogJoystickEncoder">
            <Param ref="analogDevice"/>
            <Param value="${JOYSTICK_PIN}"/>
            <Param lambda="analogReadFn"/>
        </Function>

        <Function name="initWithoutInput" object="menuMgr">
            <Param ref="renderer"/>
            <Param ref="${ROOT}"/>
        </Function>
    </SetupFunctions>
</TcMenuPlugin>